job_title,company_name,job_location,job_salary,job_description,job_posted,posted_website,job_link
SOFTWARE SUPPORT ANALYST,MineSense Technologies,"Vancouver, BC",,"We combine advanced sensing technologies, machine learning and data analytics to provide mining companies critical information that has never been available…",,SimplyHired,https://www.workopolis.com/job/Tx_3E9VxrTq1V_vlUnM-2koEWbkZwdUiBlV7wGouGPIVopekz05xVg?q=machine+learning
"Python Tech Lead, Intact Lab",Intact,"Montréal, QC",,[Asset] Excellent understanding of machine learning and artificial intelligence. [Asset] Experience with machine learning and scientific computing libraries…,,SimplyHired,https://www.workopolis.com/job/-J899I-bzKzQ1trazRnMS-ie4cydEuZM1B3juhCpI8GqtU9TFJwNmw?q=machine+learning
Software Developer - Big Data Platform,Geotab,"Toronto, ON",,"Processing billions of data points a day, Geotab leverages data analytics and machine learning to improve productivity, optimize fleets through the reduction of…",,SimplyHired,https://www.workopolis.com/job/FW9gfuk1_SNtD8Mi0TpYk-U3XsOcR9VrsVdexQZq7qh2EIK_515H4w?q=machine+learning
Project Coordinator,AbCellera Biologics,"Vancouver, BC",,"To succeed, we create innovative solutions for our partners - combining custom antigen preparation and immunizations, microfluidics, high-throughput imaging,…",,SimplyHired,https://www.workopolis.com/job/av9k0aRRKoWemMK1cv0IwlUYi9rO_h_VN5B7WhqFH6-9MsK1OrhHFQ?q=machine+learning
Medical Administrative Clerk,Bayshore HealthCare,"Ottawa, ON",,"Strong commitment to continual learning; Demonstrated ability to operate photocopiers, fax machines, and Cisco/Jabber phone system;",7d,SimplyHired,https://www.workopolis.com/job/l_Yb9_ny1VrnX9am3PDrc_ECE1MXp5o8cHn4BFUhRGDt4z8fgF7LBQ?q=machine+learning
Machine Learning Engineer – Indexing,Katalyst Data Management,Canada,,"Machine Learning Engineer - Indexing with great complex problem-solving skills, who is comfortable working. Join the dynamic and collaborative team at Katalyst…",,SimplyHired,https://www.workopolis.com/job/9C3gqtpbEhbGbEFxfbwfdhARACHpC4xaHdoxQP79zM1Dp4tMs3G0og?q=machine+learning
"Software Engineer, Knowledge",Pinterest,"Toronto, ON",,"Millions of people across the world come to Pinterest to find new ideas every day. It’s where they get inspiration, dream about new possibilities and plan for…",,SimplyHired,https://www.workopolis.com/job/AkLkbEMf6TgwiRlZWu88ScLNZdUnuQS_o8HR-8BDSglTYXqYjczSQA?q=machine+learning
Application/ Software Architect- Top Secret Clearance- Filled/Closed,Personnel Force,"Ottawa, ON",,"Experience with Machine Learning platforms architecture and design. Perform provisioning, maintenance and updates to Python Machine Learning libraries.",,SimplyHired,https://www.workopolis.com/job/CvAq85_LehzkW8wwZH8kXM-_TOiEF7KH2J6Lx39qfVss2yeM7TKEDQ?q=machine+learning
Research Scientist,Thomson Reuters,"Toronto, ON",,"Have a good understanding of machine learning, in particular, deep learning (e.g., TensorFlow). You will create large scale ML processing pipelines for training…",,SimplyHired,https://www.workopolis.com/job/zQYxSP0WAKLsg-Qr3sKB3_C4-dSmvozHZcFMgszcB9qsaGK1t9y5Gw?q=machine+learning
Administrative Assistant,D&S Enterprise Ltd,"Surrey, BC",,"Machine, Printers, computers and telephones. Oral communication, working with others, Problem solving, Decision making, Critical thinking, Continuous learning.",,SimplyHired,https://www.workopolis.com/job/oURwlkrHh_Dqrp3kh0FBQFzUO0wJKsnQe_qhKatIDL8Z6mxU8EFcPw?q=machine+learning
Product Manager,Paytm,"Toronto, ON",,"We apply big data, artificial intelligence and machine learning to bring the next generation of financial products and services to the Indian, Japanese and…",,SimplyHired,https://www.workopolis.com/job/TCK6ERzCFiM4jUeQynoVhYrt0sHh8hIdgn1boPz5aqqHCNQDHqcjdQ?q=machine+learning
Engineer I,TD Bank,"Toronto, ON",,"We also collaborated with Google and IBM to build innovative prototypes that used Natural Language Processing, Machine Learning, and Cloud Computing to…",,SimplyHired,https://www.workopolis.com/job/aFHjMTNt2aSMdvieMo7eiJHxIGBvTxipg9hs3STXfkAEtxQSkmuGLg?q=machine+learning
Postdoctoral Fellowship Position - Gender Outcomes International Group,University of Alberta,"Edmonton, AB",,Immense data scientific analytic approaches such as machine learning will be used to analyze the large data sets. Closing Date - Will remain open until filled.,,SimplyHired,https://www.workopolis.com/job/F8MQawUcEmhIMIV_tllvoHZMb0x6pQMFfGpkia7tNcwKZJ7XDGCWWg?q=machine+learning
Data Analyst/Senior Data Analyst,StackAdapt,"Toronto, ON",,This state-of-the-art platform is where some of the most progressive work in machine learning meets cutting-edge user experience. What we are looking for:,2d,SimplyHired,https://www.workopolis.com/job/LD3OTjsPlH1B55qmvB_r3PF0kqiy4dE1267lUF1B9u2VAh4HRod30A?q=machine+learning
Lead Portfolio Architect (Data),Xero,"Toronto, ON",,"Demonstrable experience leading the architectural thinking on analytical data usage, machine learning and artificial intelligence within an organization of…",,SimplyHired,https://www.workopolis.com/job/zKBY5qJ4YAms4LziiJb4E_JKXcL8Z-wOpnDkg-EvGQz-10YZRBuf5A?q=machine+learning
BI/Media Analyst,Noise,"Vancouver, BC",,"Experience with Machine Learning, Predictive Analytics, Data Modelling, etc. Ultimately the successful candidate will expand on their existing proficiencies by…",,SimplyHired,https://www.workopolis.com/job/QEzjJ1Lckywnkt1BPbJGmupRLlCcaQQaoPHt2YKiNqaPuUqQgWMu0w?q=machine+learning
Software Developer,Brock Solutions,"Kitchener, ON",,"Some interesting areas we are exploring include industrial automation, machine learning, IIOT, cyber security, AI, robotics, and other technologies.",,SimplyHired,https://www.workopolis.com/job/oLtNXcn7rT-T3ogR5_O6WJJrgxtO8BAmfoeBKaUMvdDbOl9nOd9k2w?q=machine+learning
Network Product Test Specialist,XipLink,"Montréal, QC",,Experience with Virtual Machine technology including installation of hypervisors and configuring VMs. Are you excited about being a key element in a team…,,SimplyHired,https://www.workopolis.com/job/B4mGwg5RouivdOyNy7MyDbNcPVpMolSpUqFJPMNe0airWpq1Ca566g?q=machine+learning
Program Manager 2,Microsoft,"Vancouver, BC",,"We leverage machine learning as well as cutting-edge signal processing algorithms to improve call quality, e.g., by reducing unwanted background noise or…",,SimplyHired,https://www.workopolis.com/job/5uaCSmbjhIHWMdgYRKTpJf_iHiN994JmxPQgsr9Coh6tNDR7YgD00Q?q=machine+learning
Summer 2021 Intern (Technical-Engineering),Synopsys,"Markham, ON",,Machine learning and computer vision. Synopsys technology is at the heart of innovations that are changing the way we live and work.,,SimplyHired,https://www.workopolis.com/job/q-EbfWQ0xhPB2SjeJGAgcy_I9DgtLRplBxkHjmPSB38LhLSuTrY3-A?q=machine+learning
Automation Advisor,Rio Tinto,"Kitimat, BC",,"Be informed on emerging technologies and investigate how to improve area processes using advances in automation, machine learning and mechatronics.",9d,SimplyHired,https://www.workopolis.com/job/TDyqRDA1-LOYQw3I97HrYwzduP857fhvbqGOm8c3h6KzlCpDnmiJ5w?q=machine+learning
IT Helpdesk Technician,AbCellera Biologics,"Vancouver, BC",,"At AbCellera, we’re solving tough problems and creating innovative solutions from the ground up - custom immunizations, microfluidics, high-throughput imaging,…",,SimplyHired,https://www.workopolis.com/job/HfgkrimPVcMJyCnI6qgNIwQ-Nzm6DYO05c_LQ7TohmE1zTEP206CYg?q=machine+learning
- Software Engineer,Paytm,"Toronto, ON",,"We apply big data, artificial intelligence and machine learning to bring the next generation of financial products and services to the Indian, Japanese and…",,SimplyHired,https://www.workopolis.com/job/ASe7WnuEgtmoosMwsHDak2W8XzQwj3W0mTp3h90Pi6Gt6ynulhsPhA?q=machine+learning
Energy Management Specialist,Capital Power,"Edmonton, AB",,"Knowledge of machine learning and programming experience (R, MATLAB, Python, SQL, Visual Basic) considered an asset. Join us in powering a clean energy future!",,SimplyHired,https://www.workopolis.com/job/eg1sfc2wiXe_rQqfFz74QjM8qNXxgKYpRUg87Mj7IMShKZ85umjykQ?q=machine+learning
Computer Vision Researcher,Algolux,"Montréal, QC",,"Or Masters in computer science or engineering, in areas related to computational imaging, machine learning, computer vision. Solve the real problem in the wild.",9d,SimplyHired,https://www.workopolis.com/job/FoCbPSoHM2luJxOPaOLAQ7tNIicHChSxaU8A9q8in5VYic9Yubt6Fw?q=machine+learning
Automation Specialist,Spartan Controls,"Calgary, AB",,Human Machine Interface (HMI) and configuration function testing. Proactively contribute to team learning and knowledge sharing.,13d,SimplyHired,https://www.workopolis.com/job/MYeTJNv3I7175C7tZjv2qTScu1HartZjYp6ped4wOvwkYT1yscANLQ?q=machine+learning
Business Intelligence Developer,Centro,Ontario,,Our platform processes over 300 billion events per day and uses AI and machine learning to automate and simplify the entire digital campaign process.,,SimplyHired,https://www.workopolis.com/job/0ns_hGrdYHDD_ZE7mKddfd3F4b16Xr3v7PJbTSfYvsjW15GFxFbjTQ?q=machine+learning
Electrical Engineer,HELPWEAR,"Toronto, ON",,"Machine Learning Models and Knowledge. A viable candidate will contribute to development, reiteration and testing the HeartWatch System closely with the…",,SimplyHired,https://www.workopolis.com/job/TC-GFiasJRkozlhIxY5E7ELwtsW9VtZWfXRVJKuml86jngFEwMXh_Q?q=machine+learning
"Data Scientist, Game",Prodigy Game,"Oakville, ON",,Experience working with machine learning algorithms and / or cloud platforms like AWS. Love for our mission of helping kids everywhere enjoy learning.,,SimplyHired,https://www.workopolis.com/job/flPgvTzQqZqcuH5xMvTYnJDdP2WpgtLUZVT-SzZV27XK_e4zDJtUzw?q=machine+learning
Energy Management Engineer (EIT),Capital Power,"Edmonton, AB",,"Knowledge of machine learning and programming experience (R, MATLAB, Python, SQL, Visual Basic) considered an asset. Monitoring of remote renewable assets;",3d,SimplyHired,https://www.workopolis.com/job/F1zBTx5UR18HQjlh_DgkRJaebT7kIr97jVGBU_HlhkQdTITjFDHwIw?q=machine+learning
DevOps Engineer,Compass Digital Labs,"Mississauga, ON",,"From microservices to big data to machine learning, you’ll work closely with your teammates to tackle the exciting challenges we live to solve.",,SimplyHired,https://www.workopolis.com/job/TJ4PTd3JgCVpG93kQzxe9aY1MNsG17lRVcgJguYhi49Ne4bFoYDZ6g?q=machine+learning
BAND 2 - Methods Specialist,BC Public Service,"Victoria, BC",,"Experience in data science, computer programming, or machine learning. This posting is to establish an eligibility list for future temporary and/or permanent…",9d,SimplyHired,https://www.workopolis.com/job/dWCbVeQcg43bpeCjnXxP2C_Z5pe2vBYrOf_Zouc5IqpqsaQYqAg8VA?q=machine+learning
"Material Handler-Toronto, Ontario",WestRock,"Toronto, ON",,Comprehensive training with numerous learning and development opportunities. Have the ability to operate FedEx and UPS meter machines. What you need to succeed:,,SimplyHired,https://www.workopolis.com/job/mU-TE70yBdqwnGvgh3fn4mgtAi614BhbcLk77InEvOWcAzwlScGI6g?q=machine+learning
AI Modeler/Engineer,Onmobile,"Montréal, QC",,"(a) variety of machine learning and classification regimes; Support a diverse range of programs through development and application of Machine Learning (ML),…",,SimplyHired,https://www.workopolis.com/job/LoWSx7WXQPDvtdBgxoeyQ-Mn03vT9MKfK83wk5lA4ejgXOjTvdW2xQ?q=machine+learning
Data Architect Consultant,Accenture,"Toronto, ON",,"We’re also the world’s largest team of data scientists, data engineers, and experts in machine learning and AI. A great day for us? We turn ideas into reality.",,SimplyHired,https://www.workopolis.com/job/--ErPr1sWdlofZ3qOd8SBjPVghrQVn2Yu-K41odeFuYI9V39bG2rqA?q=machine+learning
Payroll and Benefits Specialist,Axiom Zen,"Vancouver, BC",,"You are excited about emerging technology like blockchain, SaaS, mobile apps, AI, and machine learning. We’re all driven by an insatiable thirst for learning…",3d,SimplyHired,https://www.workopolis.com/job/vPHEiVSrPoCzbOtk2mAYKKB7x5WnCq18nbiB3LzDD_zLjBaqEgolSA?q=machine+learning
Co-op: Software Data Engineer,Delta Controls,"Surrey, BC",,"Work with the Data Science team on various projects including building and maintaining the data infrastructure, building the data pipeline and data storage in…",1d,SimplyHired,https://www.workopolis.com/job/hRC63RV285S_P5hcPzV1lO2neJamdwvXiJGDH1qCnrpkDRrYlfZWrw?q=machine+learning
Sr. Data Scientist,"AMZN CAN Fulfillment Svcs, ULC","Vancouver, BC",,"EconTech uses Machine Learning, Reinforcement Learning, Causal Inference, and Econometrics/Economics to derive actionable insights about the complex economy of…",1d,SimplyHired,https://www.workopolis.com/job/nPkD94nEYhKJMukoivPHpaUUdd8rkMKeOH5LUKIpmQd2ZthK_2TWZw?q=machine+learning
Administrative Assistant,N R Excavating & Services Ltd,"Surrey, BC",,"Oral communication, working with others, Problem solving, Decision making, Critical thinking, Continuous learning. N R Excavating & Services Ltd.",,SimplyHired,https://www.workopolis.com/job/j5JZw_hBtFem05RhkTfD4HddaKVWfym7whvx0ojdewPrjbsEdakE6Q?q=machine+learning
Enterprise Architect,Synamedia,"London, ON",,"This will result in translating into requirements along with developing products using machine learning, data visualizations, and decision support systems to…",1d,SimplyHired,https://www.workopolis.com/job/0mlEFV4IuSqikg2Tmf5TEGLDOzfgqD6Qod1PuGkq-7QoLer3ysg80Q?q=machine+learning
Senior Data Engineer,iQmetrix,"Regina, SK",,"Background in Big Data, non-relational databases, Machine Learning and Data Mining is a plus. Once the new data platform is created you will be able to realize…",,SimplyHired,https://www.workopolis.com/job/xegc947ZCiVX6ijIfZIIxEp05rTaeHXtSKEaa_iIeoQf4CGvWKFajA?q=machine+learning
Senior Audio Enhancement and Signal Processing Engineer,SoundHound Inc.,"Toronto, ON",,"Knowledge of machine learning and familiarity with machine learning frameworks, such as Caffe, Tensorflow, Torch, PyTorch, MxNet, etc.",,SimplyHired,https://www.workopolis.com/job/NF1jsGcvg_BjoObtXOG9MP_fwfZQAExttUmqs0lkUpC1tFUV-1xpJQ?q=machine+learning
Clerical Assistant,University of Saskatchewan,"Saskatoon, SK",,Book meeting rooms and maintain the printer and fax machines; We are dedicated to recruiting individuals who will enrich our work and learning environments.,,SimplyHired,https://www.workopolis.com/job/Xqxi8AihimGaepDtD8LDZw4prvXWIDZVz441fxAxQ4jnIi9w-1FY3g?q=machine+learning
Farm Supervisor,N & B FARM,"Abbotsford, BC",,"Problem-solving skills, decision making, critical thinking, continuous learning. V Direct and assist in repair and proper working of machines and equipment used…",,SimplyHired,https://www.workopolis.com/job/h0d6fLJHSO0oyHVNR9YmyOth5Z8t7Xz62fVo4By22v3uGs6J2OkHMg?q=machine+learning
"Quantitative Business Analyst, Analytics and Decision Support, YouTube",YouTube,"Toronto, ON",,"Experience in machine learning (e.g., supervised learning, clustering). Bachelor's degree in a quantitative discipline (e.g., Statistics, Computer Science, Math…",,SimplyHired,https://www.workopolis.com/job/49AnaYEVqfeOcRoeCPcDJPQrbAR--Ad1w6bPoW5tan1vILxVIjeG8A?q=machine+learning
"JavaScript Developer, Data Visualization",Geotab,"Oakville, ON",,"Online learning and networking opportunities. Processing billions of data points a day, Geotab leverages data analytics and machine learning to improve…",,SimplyHired,https://www.workopolis.com/job/-G1weHxmpj0Gh6dx1CNglJEEznjmOX1waBjgeQ0L-rDHhJ0qPpot1Q?q=machine+learning
Robotics/Computer Vision Engineer,Brizi,"Toronto, ON",,"PhD or Masters graduate with 2+ years of practical work experience in Robotics, Computer Vision, Machine Learning, or a related field.",,SimplyHired,https://www.workopolis.com/job/sHLxKcQdT0fCABUUtRrrjFU7cYnLYrsZP_UiHJjWJd9WkPY0Wib_ww?q=machine+learning
Housekeepeer,Revera Inc.,"Rexdale, ON",,"To operate floor care machines and steam cleaning equipment. Building capability of self, individuals and teams by engaging in feedback, coaching, learning and…",,SimplyHired,https://www.workopolis.com/job/izYUoKG1DMZTnf8txF-Th3vboZaBSokfLyAySH6IMKSmfjgP6NcGug?q=machine+learning
Data Engineer (Cloud),StackPros,"Toronto, ON",,"Help the DRVN Intelligence Data Systems team adopt and evolve Predictive Modeling, Machine Learning and Deep Learning processes to deliver to clients in the…",,SimplyHired,https://www.workopolis.com/job/_x1zvIKhu3DNqiYnEMnD5mYpBYa98ay26l9wtDm6iIqLYlC9YbRSpg?q=machine+learning
Software Development Engineer II (Data Engineer),MasterCard,"Vancouver, BC",,"Excited about using Big Data, AI/Machine Learning and Data Analytics to deliver actionable insights? Interested in building the next generation platform that…",,SimplyHired,https://www.workopolis.com/job/skRLW7VVay40EM9zsnAF8sBCBMEezHhi2dQnbSjT2_lis4DHX3Cltw?q=machine+learning
Chief Revenue Officer,Shinydocs Corporation,Canada,,"Founded in 2014, we leverage artificial intelligence and machine learning to help companies organize their documents by finding unstructured information…",,SimplyHired,https://www.workopolis.com/job/yLc475Q4ctFJgJcU1rpyW9XQ89XidppI4glhU3QOvbNEdBxoIu_ljw?q=machine+learning
Finance Transformation Partner,Munich RE,"Toronto, ON",,"Opportunities to effect change on this scale are rare, and we want to hire the best and brightest to bring a unique perspective to our industry and accelerate…",,SimplyHired,https://www.workopolis.com/job/2ztR3lfe4vgoWp6mK8JMUFWKYpBHvqqkdhDB6_AW8ekeZqxolrRvUg?q=machine+learning
SW QA Developer,IBS Software,"Montréal, QC",,"The SW QA Developer will join the Montreal IBS Software Canada Team in Montreal, IBS’s new center of excellence for optimization, data sciences and machine…",,SimplyHired,https://www.workopolis.com/job/yvDkevI161-mniTj_apE0VxTmA754uBO4CdnzN9Zy1U31bn6XhCFZQ?q=machine+learning
PRODUCTION OPERATOR,Avalon Dairy,"Burnaby, BC",,"Grind, scrape, sand, or polish surfaces using abrasive tools or machines. Strong working mechanical knowledge of machines and tools, including their designs,…",,SimplyHired,https://www.workopolis.com/job/l6pvuBKY8l8h-pUg4LTr_XdxpnEtEGstT7Lwo156yCa7zdbvPhaoXg?q=machine+learning
Accounts Receivable Specialist,Geotab,"Oakville, ON",,"Online learning and networking opportunities. Processing billions of data points a day, Geotab leverages data analytics and machine learning to improve…",,SimplyHired,https://www.workopolis.com/job/f9Fgq62M_txCQd10dtwLylskx-AjZLBY6Iln9Pxhq3yvRgdkNNGqkg?q=machine+learning
Technical Product Owner - RACE21,Teck Resources Limited,"Vancouver, BC",,"Deep understanding of big data, machine learning, business intelligence, data analytics and advanced visualizations is highly desirable.",,SimplyHired,https://www.workopolis.com/job/72UejkltJLczi0su86YxEVtW0Zldpdk--K6YgOr5Bd9sgKE8jidmxQ?q=machine+learning
Data Engineer,Easton Diamond Sports,"Mississauga, ON",,Experience with Machine Learning languages is a plus. We're interested in learning more about you and appreciate you taking the time to apply online at www…,,SimplyHired,https://www.workopolis.com/job/UESlo9rsCIScO3IhFzVly6jFY5lQVK28XQodaqCbGYVYZahPFgWIkA?q=machine+learning
Plant Manager,Kongsberg Automotive,"Shawinigan, QC",,"Develops plans for efficient use of human resources, materials and machines within the Plant; Embraces the Learning Organization and empowers employees to…",10d,SimplyHired,https://www.workopolis.com/job/4kTWNb-zzyHYDrX4wPxuN3LDEOENKGFst3UvJGdPgfsZl_K3xadLFw?q=machine+learning
Houskeeper,Revera Inc.,"Brantford, ON",,"To operate floor care machines and steam cleaning equipment. Building capability of self, individuals and teams by engaging in feedback, coaching, learning and…",,SimplyHired,https://www.workopolis.com/job/cXaDD2rKN37nFVjWh1xjov0xt-lODFIxJM6J0Vx7GKmIulJ2Ah-Juw?q=machine+learning
Butcher - retail or wholesale,Vene-Rica Meats,"Toronto, ON",,"Power grinder, Slicing machine, Band saw, Sausage machine, Salami mixer and cooker, Manual cutting utensil. 3 years to less than 5 years.",,SimplyHired,https://www.workopolis.com/job/BXR7UsTeJ-py9UPQAs10kZJF0ZlAdIWqUTzxLtjwMbcIELoKSK9plw?q=machine+learning
Senior Recruiter,Revolut,"Toronto, ON",,"You thrive in a collaborative space where everyone’s learning from each other, and learning fast. We want everyone at Revolut to own their story and their…",,SimplyHired,https://www.workopolis.com/job/PHoVE0bTVdzoV7-xcJ1naRmqFmxEauOd_lsZuzoaJJnXn6F_OttYFA?q=machine+learning
Développeur SQL,Keyrus Canada FR,"Montréal, QC",,"La Data Intelligence qui permet aux entreprises de tirer des axes de réflexion des données à leur disposition, et élaborer des décisions d’affaire (Intégration…",8d,SimplyHired,https://www.workopolis.com/job/Z0vp5qFzyEkRaKeKGSoOeH6vuUbDATXiPwzZ_nj7nAvn0oukRxYk2A?q=machine+learning
Bilingual Call Centre Specialist,Credit Sesame,"Toronto, ON",,"Headquartered in the Bay Area with presence across the US and Canada and growing globally, Credit Sesame is helping consumers' cash work for their credit and…",,SimplyHired,https://www.workopolis.com/job/mHSD-6kZ0z8zs8m7Wk1SnLh17z5Xh2BbLteg6iY95kxpZ_Q23iuhpA?q=machine+learning
Data Systems Designer,Eclipse Automation,"Cambridge, ON",,"Big Data, machine learning interfacing. Experience in an automation environment, machine learning and analytics, SCADA, MES and ERP Systems will be considered…",Today,SimplyHired,https://www.workopolis.com/job/2zGZ7B0LBkcws6O8hojOBA9dREglrdcqIhHohDx_fTaZmB7dcq2rgw?q=machine+learning
Programmatic Media Analyst,StackAdapt,"Toronto, ON",,This state-of-the-art platform is where some of the most progressive work in machine learning meets cutting-edge user experience.,2d,SimplyHired,https://www.workopolis.com/job/CTb8aSHxLYjASeGDXJLucAy4QqlUAZ7vxyRhthSwQBaT0tSPsJgOLw?q=machine+learning
Software Applications Engineer,Praemo,"Kitchener, ON",,"Support the deployment of machine learning based products/solutions, which provide descriptive, diagnostic, predictive, or prescriptive models based on data in…",,SimplyHired,https://www.workopolis.com/job/B_Ad3qUgX9YtcNvbX2WXfqkMRw7hY10S582x0H_rK5rycP1jihTZMw?q=machine+learning
Scientifique de données,Optel Vision,"Quebec City, QC",,"Il est autonome, possède une grande capacité à travailler en zone grise ou devant une page blanche et fait montre d’un grand sens de l’innovation.Le…",,SimplyHired,https://www.workopolis.com/job/9fttzs9D08dOiq4SXuAN0DQ5qBv1hWKTJztBnwFtUsGlLZurWSl8YQ?q=machine+learning
System & Operations Specialist (DevOps),Ubisoft,"Montréal, QC",,"Assist with imaging physical machines; Design, build, deploy, monitor and maintain various configurations and deployment tools for physical machines;",,SimplyHired,https://www.workopolis.com/job/gTTJFbAwWf2jCyTm53eUX-GXZfVszaURVRmgGXpcukM8-7h4U_kV7A?q=machine+learning
Consultant(e) Qlik Sense/Qlik View,Keyrus,Canada,,"La Data Intelligence qui permet aux entreprises de tirer des axes de réflexion des données à leur disposition, et élaborer des décisions d’affaire (Intégration…",,SimplyHired,https://www.workopolis.com/job/DfYv0AzPX_IqoNm91it1vX814ndINelOvSaT6Y1gNrAasMYOLT0UfQ?q=machine+learning
"Analyst, Marketing Analytics",AIR MILES,"Toronto, ON",,Develop advanced analytics based on predictive modeling and machine learning methodologies. It's fun to work in a company where people truly BELIEVE in what…,7d,SimplyHired,https://www.workopolis.com/job/1b3p2Nk7cDEoMWos2KbXHn7xRR2g4c7Iws0B1zmlrQaKKxDP5thGQg?q=machine+learning
DevOps Engineer,Peak Power Inc.,"Toronto, ON",,"Broad knowledge of software development, APIs, data stores, networking, security, machine learning and cloud computing services. Our new DevOps Engineer will:",10d,SimplyHired,https://www.workopolis.com/job/GPu7uCDuw0LOoczRosPQG-ngzImbkWnFtZE4XOvDG0JUX_gintjTTQ?q=machine+learning
Head of FP&A,Hopper,"Toronto, ON",,We are leveraging the power that comes from combining massive amounts of data and machine learning to build the world’s fastest-growing travel app - one that…,13d,SimplyHired,https://www.workopolis.com/job/uZsEPKsh32lCDtqZ9gIkgITxeyFi5qA4u3hrTy4nElgh0c3jhJR0MQ?q=machine+learning
Full Stack Developer,Jonas Software,"Halifax, NS",," Experience with ReactJS, Couchbase, Elasticsearch, Docker Containers, and Machine Learning are all plusses.  Learning on the Fly:  Other duties as assigned.",,SimplyHired,https://www.workopolis.com/job/aqzubhvJYIeAr7REnDa0Lu2zU2uE2Qipi_3nJczi6-Y64miZ4dyFyg?q=machine+learning
Principal Investigator,Ontario Institute for Cancer Research,"Toronto, ON",,The Ontario Institute for Cancer Research (OICR) is seeking a Principal Investigator (PI) in Computational Biology to undertake world-class computational…,,SimplyHired,https://www.workopolis.com/job/BNM6AXSTxXuFzR-aHiKKWAhQP-2kkve2K8sStNkot0pLNWUKyMlyzg?q=machine+learning
Warehouse Associate,Cardinal Health,"Burnaby, BC",,You have interest in learning about warehouse operations. You want to work with systems and scanners and learning new skills. This Job might be for you if:,1d,SimplyHired,https://www.workopolis.com/job/_16B-0M1VK_9Xk6nzZhwllRdDyJkPXNQbstY7JHIyfXf0vRxa--jhQ?q=machine+learning
hitch professional,U-Haul,"Calgary, AB",,"Are you interested in learning valuable technical skills? The work involves moderate risks or discomforts which require special safety precautions, e.g. working…",,SimplyHired,https://www.workopolis.com/job/wt4HAWZ3YScS-YMa_R8HsOFnOh9xgVhibHmfwZxtCcB_ov7FV4xddg?q=machine+learning
Summer 2021 Intern - Software Engineer - Tableau CRM,Salesforce,"Vancouver, BC",,"We have highly interactive UI, machine learning, and distributed system scalability challenges. To get the best candidate experience, please consider applying…",,SimplyHired,https://www.workopolis.com/job/kMbeAd1Y6QEKdYEyLkt0pEuMKvUYwXP8jXAT0Sl2KCJkIm7TrLM3NA?q=machine+learning
