job_title,company_name,job_location,job_salary,job_description,job_posted,posted_website,job_link
Senior AI Research Engineer,LG Electronics,"Toronto, ON",,"You will work to support advanced AI research and aim to optimize iterative development of machine learning algorithms – making the process scalable, more…",,SimplyHired,https://www.workopolis.com/job/8NiLPWVXMl7xIkNuEkAKjAt85F4_Nz37wnlcP_V3qToiV_S0cMz2Vw?q=machine+learning
Hair Stylist,Aru Spa and Salon,"Surrey, BC",,"Be committed to continuous learning. Our philosophy is strongly based around natural health and wellness, which is why you will not find any laser machines,…",,SimplyHired,https://www.workopolis.com/job/MC8upkZxAC-pyrY1qS57yUkZL4r6QqPaxW_CigN8JDU2XLYOmesPeQ?q=machine+learning
Senior DevOps Specialist,Appnovation Technologies,"Toronto, ON",,"The technology department is focused on delivering software solutions that enable rich consumer experiences, from mobile and web applications to advanced…",,SimplyHired,https://www.workopolis.com/job/ciGXpdJaIowNz-cq1AVbkFduQ0KNqnq3yyJch7sG9KwHs2OdHzTwfQ?q=machine+learning
"Ingénieur de recherche, Core ML",Facebook,"Montréal, QC",,Experience developing machine learning algorithms or machine learning infrastructure in Python or C/C++. Facebook's mission is to give people the power to build…,,SimplyHired,https://www.workopolis.com/job/tT569gboku0fnKPvAkahcGfkeAS7k2HIYAFOe374FdqoHT3An4FTxw?q=machine+learning
Software Developer – C# .NET,Shinydocs Corporation,"Waterloo, ON",,"Founded in 2014, we leverage artificial intelligence and machine learning to help companies organize their documents by finding unstructured information…",,SimplyHired,https://www.workopolis.com/job/9VsRuHkj6uYY3M7uX570p0GxctqKRqD7D5owKdkcv2Vga8hub4zf2g?q=machine+learning
Opérateur au moulage,Le Groupe Canimex,"Drummondville, QC",,"Understand the basic mechanical, hydraulic and pneumatic operations of machines. Comprendre le fonctionnement de base en mécanique, hydraulique et pneumatique…",,SimplyHired,https://www.workopolis.com/job/GB9QVNqSsMKOVTwCDTU4z3AUqJhRxyJbiZOminCkkaob8Y7CW-8iOw?q=machine+learning
"Manager, software development, Omnia AI",Deloitte,"Toronto, ON",,Learn from deep subject matter experts through mentoring and on the job coaching. Be encouraged to deepen your technical skills…whatever those may be.,,SimplyHired,https://www.workopolis.com/job/eeCEZVp4Zm4RSzIIzO3P-Ny8NMOcLuEYs4NH9LBniZ9rgCegCVbVAw?q=machine+learning
Account Manager,StackAdapt,"Toronto, ON",,This state-of-the-art platform is where some of the most progressive work in machine learning meets cutting-edge user experience.,2d,SimplyHired,https://www.workopolis.com/job/xYsTDqdUku4C5eLKT7ARaeOYX24Qw9-lRo5V55emhe6Xp0PIyGENYg?q=machine+learning
"Principal Scientist and Group Lead, Molecular Simulations",Zymeworks,"Vancouver, BC",,"Proven experience applying machine learning approaches for data mining and knowledge driven protein modeling and optimization. C, C++, Java or FORTRAN).",,SimplyHired,https://www.workopolis.com/job/TW4CNTTF-_AdhZzX6Cgz6Uy_FEE7dFZUzjPLVvgtq0wi3pRSHI_VuA?q=machine+learning
Systems Technician,House of Commons,"Ottawa, ON",,"Learning, professional development and advancement opportunities. Understanding in X-Ray machines and/or metal detectors; Work at the Heart of democracy.",7d,SimplyHired,https://www.workopolis.com/job/w-y4p4LOjawKC0KLnEkhBFO8BMRjuYwvlh4zdgzBiXpw0Js7nSK8ZA?q=machine+learning
Assistant Professor of Teaching - Computer Science - Tenure Track-2,University of British Columbia,"Vancouver, BC",,"Cloud Computing, Databases, Machine Learning, Information Visualization, Data Science Ethics, etc. Promise of, or experience with, educational leadership at the…",13d,SimplyHired,https://www.workopolis.com/job/H08jd-jvRB1yJI38XG6b4sT0fhnNPpzyWSZcSpFOh7RsDYHbjg99RQ?q=machine+learning
Engineering Manager - Consumer Growth (Remote),Yelp,Remote,,"You will work closely with product managers, marketers, machine learning specialists, and data scientists to deliver impactful changes to users.",,SimplyHired,https://www.workopolis.com/job/7Q8Y5xquuf1Fyzgw5lpeXiFPPWYuKrKJXbla0qwczfF4E8_4k2n7VA?q=machine+learning
Développeur / Développeuse logiciel – Interface,Comact,"Mirabel, QC",,"Intelligence Artificielle et machine learning (un atout) ; Passionné, le développeur logiciel – Interface programme en Java dans un environnement dynamique…",,SimplyHired,https://www.workopolis.com/job/91dHUI9nllZVeQALeINBbWLnB-ZbNvu24FI4x32ZAK0fAEp4neKYzw?q=machine+learning
Data Engineer,"Amazon Data Services CAN, Inc.","Vancouver, BC",,We are moving from traditional database technologies to near real time data processing and advanced reporting services built around natural language processing…,,SimplyHired,https://www.workopolis.com/job/b2AxtXJdxM65U3KFMEWufulDpvSJ0WyKCpR7AQ1hX1yxBREulXRhKA?q=machine+learning
"Manager, Data Solutions",StackAdapt,"Toronto, ON",,This state-of-the-art platform is where some of the most progressive work in machine learning meets cutting-edge user experience. What we are looking for:,2d,SimplyHired,https://www.workopolis.com/job/IATLeCCob_CD8b3iS89aH_Rr839iUaln7Uv2ahA3jGHGb35h_YoZOQ?q=machine+learning
"Executive Assistant to the Associate Director, Academic Services",Durham District School Board,"Whitby, ON",,"The vision of Durham District School Board (DDSB) includes strategic priorities and operational goals that Ignite Learning, which include Success, Well-Being,…",1d,SimplyHired,https://www.workopolis.com/job/jGvRNlr7fVUd7vrmKLscz_4Zr_0UgnfFgnscuZ2YlubM-r1Mr_kT8g?q=machine+learning
Mechanical Engineer,Ranovus,"Ottawa, ON",,"Social networking, machine learning, and big data analytics demand ever-increasing network connectivity. RANOVUS, with operations in Ottawa, Canada, Nuremberg,…",,SimplyHired,https://www.workopolis.com/job/kznh4tD53dcqDFZQEfXwzDg5DUYcL8-TsHBzBU3oVrdeQLt3Ml8Q9g?q=machine+learning
Senior Software Architect,Roboeye,"Toronto, ON",,"Machine learning, deep learning experience especially with robotics. Translating business requirements into systems and application designs that will achieve…",,SimplyHired,https://www.workopolis.com/job/uPtlnm5u7GYi9qXy92_ShnIHFFt1GAyfjn4Pn5TIa5n19fc-zUl4bA?q=machine+learning
"Senior Software Engineer, Backend",Credit Sesame,"Toronto, ON",,"Headquartered in the Bay Area with presence across the US and Canada and growing globally, Credit Sesame is helping consumers' cash work for their credit and…",,SimplyHired,https://www.workopolis.com/job/0awD1GiW8OQ0BrUtQv5_EAAqrMezTIUrhAiXAayne0Sj3xOfWio8EQ?q=machine+learning
Infrastructure Engineer Remote,SYNITI,"Toronto, ON",,"Through a combination of unique data expertise, services, and intelligent software leveraging artificial intelligence and machine learning, we help clients…",,SimplyHired,https://www.workopolis.com/job/b6KNta2elBriVwGmmMVBeec7J7q76tifirONyYK1ipSZStOSmzt-3g?q=machine+learning
Sales Manager - North America (Calgary),Echobox,"Calgary, AB",,"Using novel machine learning techniques, we are revolutionising the publishing industry and have a track record of building things that others have ruled out as…",,SimplyHired,https://www.workopolis.com/job/CS0wGlCvPDjjBYLBM_oogOPoXVo6h0LzZVbqlAV1nFx4Bli2d_SF7Q?q=machine+learning
Développeurs logiciels,Intelcom Express,"Montréal, QC",,"La société est en grande transformation technologique en ce qui concerne l'expérience client, le numérique, les plates-formes de données, le data science, le…",,SimplyHired,https://www.workopolis.com/job/zm0w4S-RHP1Yi8R79x8mw6KjOTDhejtFGFAoFdrcXWnzSDtFYwXKKQ?q=machine+learning
Sales Representative,Munich RE,"Toronto, ON",,"Opportunities to effect change on this scale are rare, and we want to hire the best and brightest to bring a unique perspective to our industry and accelerate…",Today,SimplyHired,https://www.workopolis.com/job/nh6MQyveNM4kLUiW3h2jbQl2Rgl6YpXH5RJJ2R3p0QPn32eOt3PcjQ?q=machine+learning
DevOps Engineer Intern - 2021 Winter,Micro Focus,"Ottawa, ON",,"We use big data, machine learning and advanced behavioral analytics to detect and prevent the theft of intellectual property...simply put…. What we do for you.",,SimplyHired,https://www.workopolis.com/job/NaaCu5sxUxm-iFWN1qw6lGKzJU-Xx0vrm6nbeo1cYnJaloMnh1C_zQ?q=machine+learning
Production Team Member,Blount International,"Guelph, ON",,"Machine operation experience is an asset. We believe our team members are the foundation of our Company's success, and we are committed to continuous…",,SimplyHired,https://www.workopolis.com/job/2MF3g_utbYlBi-xBhhqnLua0mUCVoRf17t7w3BeouEsuxUuIZwII8A?q=machine+learning
FP&A Senior Analyst/Analyst,Hopper,"Toronto, ON",,We are leveraging the power that comes from combining massive amounts of data and machine learning to build the world’s fastest-growing travel app - one that…,10d,SimplyHired,https://www.workopolis.com/job/RI_8cCPidRJcvidCHk1bmjxcbk77uYr5Pdyc8zhFpcYx8MVskVDMqQ?q=machine+learning
5G Software Development Environment Designer,Dell Technologies,"Toronto, ON",,"We are helping customers move into the future with multi-cloud, AI and machine learning through the most innovative technology and services portfolio for the…",,SimplyHired,https://www.workopolis.com/job/B35cV3u1FLr1hMKXnt7Gnb8AiFTFJj28oOaAIiRYMqLPQoctee458Q?q=machine+learning
User Experience Design Specialist,SAP,"Montréal, QC",,"We empower businesses to manage the complete customer experience by bringing together customer data management, machine learning and microservices to power real…",10d,SimplyHired,https://www.workopolis.com/job/lFn6YdIk067-4Up-SPXWrXwi7UDlqEOyWOwfElt6t-tGTbdtDnZE7w?q=machine+learning
Licensed Insurance Representative Assistant,The Co-operators,"Moncton, NB",,"Provide support for Contact Centre fax machines, photocopiers and troubleshoot before calling. We look forward to learning more about you and we welcome you to…",2d,SimplyHired,https://www.workopolis.com/job/J6UdbvD-kaV4md1RjUMq6m0uQFRxA3ZAwSQE-DCI95i8CB2Y_wFHFQ?q=machine+learning
Engineer Officer,Canadian Armed Forces,"Saint-Jean-sur-Richelieu, QC",,Timber and rope field machines. You will build upon the leadership training you received in basic officer training in addition to learning the skills required…,,SimplyHired,https://www.workopolis.com/job/Sz3lS7dfCijMXt5My6ePC5g-6KgYaBvc59LHQrB3xLhxQsRTGkbGpg?q=machine+learning
"Scientifique de données principal, Intact Lab",Intact,"Montréal, QC",,Compréhension de niveau expert sur la théorie sous-jacente de « Machine Learning ». Développer des solutions novatrices pour la reconnaissance de tendances en…,,SimplyHired,https://www.workopolis.com/job/OpR7J7GUZRBEnvXzkrFqFRsZ_gDlyy3oVkwOXEY4Wkot1LiCYsYPDg?q=machine+learning
Graduate Geotechnical Engineer,Arup,"Toronto, ON",,Graduate Geotechnical Engineer – Available June 2021. Are you looking for an opportunity to shape a better world? Ability to perform in a deadline environment.,,SimplyHired,https://www.workopolis.com/job/tNo_6RoyvckHcDV5D7j8gJTtqkcslihfX1Rv87gII9WSvYXynydoYQ?q=machine+learning
Business Development Associate,Winterlight Labs,"Toronto, ON",,"Our machine learning based technology analyzes both the acoustics and content of speech and language, to help identify disease and quantify its severity.",,SimplyHired,https://www.workopolis.com/job/yUVZSrHBSpMPl96ClSPa83oxfRaHEz0f0nmd2499iqMu_fMgOjk65g?q=machine+learning
"Manager, Regulatory and Compliance",Namaste Technologies,"Toronto, ON",,"We have years of data collected on legal cannabis users and by combining machine learning technology with telemedicine apps, we’re monetizing this information.",,SimplyHired,https://www.workopolis.com/job/vbB7f4krPtRTGLkgMK3js2FFXridnFe9HS2w4w15izHHZ6fFcYMASg?q=machine+learning
GRID ADVANCEMENT ENGINEER,The MEARIE Group,"Ajax, ON",,"Participate in a continuous learning manner with respect to new and emerging electric distribution system technologies with positive operation impacts,…",3d,SimplyHired,https://www.workopolis.com/job/piyFUWYBWTnlpPHfxzXCBSKxBZ6WY85dacgixrjPiaNeGK6AR_YK4Q?q=machine+learning
On-Call Utility,Altium Packaging,"Surrey, BC",,"May operate bagger and de-bagging machines. Altium also invests in our employees by providing tuition reimbursement, learning and training opportunities.",,SimplyHired,https://www.workopolis.com/job/G-vEGaRlN2YCluxh7GHozI2KLhdHYPO3qxLppTdFpsEnCamjjc1z3A?q=machine+learning
"Specialist, Accounting",Samsung Electronics,"Mississauga, ON",,"Including free Starbucks coffee/latte machine. Access to Samsung U for 24/7 online learning. At Samsung Electronics Canada, we take pride in the creativity and…",,SimplyHired,https://www.workopolis.com/job/l8LbdaPOhy9RuGWAmPuKYSx980gSOFLVvvvLD-QtfUolBtJupjTzjw?q=machine+learning
"Programmeuse, Programmeur back-end – apprentissage automatique (Groupe technologique)",Ubisoft,"Montréal, QC",,Des notions solides en apprentissage automatique qui vous permettent d’intégrer des composantes Machine Learning et d’être en mesure de les modifier.,,SimplyHired,https://www.workopolis.com/job/sk3cIeTngYApTtI8JqK448q_XIGOX1qNqPr8p7Hi4KYPviRcPikhuw?q=machine+learning
"Director, Product Management - Kim Kardashian Hollywood",Glu Mobile,"Toronto, ON",,"Drive new innovative efforts in the areas of personalization and machine learning. As the Director of Product Management, you will be leading one of the most…",,SimplyHired,https://www.workopolis.com/job/qywDhzbGTHEMQqhf8XJfule5Jc8L-R5c75x9oaQEtdX_Liiuutpf-A?q=machine+learning
Big Data Engineer - Analytics,Micro Focus,"Ottawa, ON",,"Familiarity with data science or machine learning packages (pandas, R, TensorFlow, etc...). Implement model data flows to support running cutting-edge machine…",,SimplyHired,https://www.workopolis.com/job/R8C8I2BsbRA6EruTKTddgjpBZN8KvlvjDDxsgApeCGz3ru6T1kaVjA?q=machine+learning
Maintenance Millwright,Lafarge Canada,"Bath, ON",,"Also operate machine tools such as drills and grinders to fabricate parts required during overhaul, maintenance or set-up of machinery.",,SimplyHired,https://www.workopolis.com/job/ipO5MIf1Giohd6HxsjXh68F0NX2gkAkP0bI8Gzz57GCU_uRRtDFQ-A?q=machine+learning
Senior Software Engineer,General Motors,Ontario,,Experience with Machine/Deep Learning algorithms. 3+ years of Computer Vision/machine learning/deep learning expertise. Basic knowledge of controls theory.,,SimplyHired,https://www.workopolis.com/job/Gp7matjD1Od6fpIjlDolccMn8OjQb7_8XSaH1yZQfjylAKfJU4TJuA?q=machine+learning
Business Analyst,Vantix Systems Inc,"Edmonton, AB",,"Business intelligence (BI), data analysis, data analytics, data visualization, data management, data lake, big data, data security, artificial intelligence (AI)…",,SimplyHired,https://www.workopolis.com/job/FaFDOVGFrygkeMZ2i2mOsplld5TVMZ-iMpH4oYJHc41cRL5bQH7mmA?q=machine+learning
Director of Analytics,Bill Gosling Outsourcing,"Newmarket, ON",,Bill Gosling Outsourcing is committed to the career development of our people. If you are interested in joining a company with modern facilities and a team…,8d,SimplyHired,https://www.workopolis.com/job/h-V_X3HVFvfsy7NoRMv8Wjby6GIh-8Kj3JA3PXP8jWMwpudj5Q4bcQ?q=machine+learning
Data Architect (French Service),CBC/Radio-Canada,"Montréal, QC",,A robust data architecture allowing us to easily marshal our data for machine learning analysis is one of the pillars of this customization initiative.,,SimplyHired,https://www.workopolis.com/job/Jl2DnV_M9qzynzOoUqo8ZU12HAdSswRbv4xaOPzQb69fi4kG29YYeg?q=machine+learning
SOLUTION AND DATA ARCHITECT BI AND AZURE,KPI Digital,"Montréal, QC",,"More specifically Analytics, Digital Marketing, Big Data, Insights, Customer 360, Artificial Intelligence (AI), Machine Learning and Internet of Things (IOT).",,SimplyHired,https://www.workopolis.com/job/Dw-nBWLKIH9ghR54bSGWQQjUDSNpEzZEhRbF21Dym3pnZhmjRRr20w?q=machine+learning
Senior Web Architect,Paytm,"Toronto, ON",,"We apply big data, artificial intelligence and machine learning to bring the next generation of financial products and services to the Indian, Japanese and…",,SimplyHired,https://www.workopolis.com/job/atya461AN74-CzHBR-ygUdRICjCDNsaf67MqU4S22WgQa1Co-fi5xw?q=machine+learning
Full Stack Software Engineer (SaaS platform),Boast Capital,"Toronto, ON",,"Experience working with machine learning, information retrieval, natural language processing. Each year the US and Canadian governments give out billions of…",,SimplyHired,https://www.workopolis.com/job/RrI836siinvZSLJqvM_N3a-Sx8yucJYCVWHfDwmhAP8sURW3lb5tBw?q=machine+learning
UX/UI Designer,Paytm,"Toronto, ON",,"We apply big data, artificial intelligence and machine learning to bring the next generation of financial products and services to the Indian, Japanese and…",,SimplyHired,https://www.workopolis.com/job/59OS1RXUWyExKvRsTbtJIyVpiQV4e9mRvxGA0-72gY_4iCYty-KfZw?q=machine+learning
U-Haul Storage Center Assistant Manager,U-Haul,"Ottawa, ON",,"The work involves moderate risks or discomforts which may require special safety precautions, e.g. working around moving parts or machines, fumes, irritant…",,SimplyHired,https://www.workopolis.com/job/dDhAs3VgbH7lXwRMG0WOPIw7v0TBfpJzstfE-qBVNQSF8U4n1yKtZQ?q=machine+learning
Senior Data Engineer,Guavus,"Montréal, QC",,"Guavus is at the forefront of AI-based big data analytics and machine learning innovation, driving digital transformation at 6 of the 7 world’s largest…",,SimplyHired,https://www.workopolis.com/job/GChj8bBPFZSL55ffl2kWf2WBt3FI3DOT1fmresbkGd-IJKG07YzM9A?q=machine+learning
Control Panel Builder,WATTCO,Canada,,"Follow all NEC codes to run conduit on equipment and machines per electrical schematics. This person must demonstrate ability to read electrical schematics, be…",,SimplyHired,https://www.workopolis.com/job/7BTdkkEgl4li0pXi2zTWrob0OXeOpajFORnQ8_EkOOk96qwUaYHWSQ?q=machine+learning
"Senior Software Developer, Omnia AI, Toronto",Deloitte,"Toronto, ON",,"Deploy data analytics automation and machine learning techniques to manage data, predict scenarios and prescribe actions. What will your typical day look like?",,SimplyHired,https://www.workopolis.com/job/q_P9a5ncu2Ucii3PeUAyBW-vUP5MEKzFMjZDzy7YKznNn7ittghIPg?q=machine+learning
DevOps Cloud,Keyrus,Canada,,"La Data Intelligence qui permet aux entreprises de tirer des axes de réflexion des données à leur disposition, et élaborer des décisions d’affaire (Intégration…",,SimplyHired,https://www.workopolis.com/job/sxAo8C02rEkQRNWs4ffAEF01p4ACOxqkVeTbsB6I3GZO5n35N2QxAA?q=machine+learning
"Intern, Enterprise Architecture",Canadian National Railway,"Montréal, QC",,"Knowledge of AI, Machine Learning, Internet of Things (IoT), Big Data, Computer Vision, advanced analytics, automation, and positioning technologies.",3d,SimplyHired,https://www.workopolis.com/job/0EiLwNQ5LJk2ndvdEXzJIRWmoAz9BoR-b4TV2dLcumYdLDMJ7wjBCw?q=machine+learning
Data Analyst/Senior Data Analyst - Business Intelligence,StackAdapt,"Toronto, ON",,This state-of-the-art platform is where some of the most progressive work in machine learning meets cutting-edge user experience.,2d,SimplyHired,https://www.workopolis.com/job/hUtzWtA5jATNYGNHybp3q4gmxWQ75Yx8WK2D3SRKpN3izpGvPf6lWA?q=machine+learning
Cloud Specialist- Business Intelligence,Ubisoft,"Montréal, QC",,"Interest in working with data related topics like warehousing, visualization, storage, pipelines, machine learning; 3+ years working with DevOps practices.",,SimplyHired,https://www.workopolis.com/job/O5KKL1JXG_7rSnLIsjW4LfViyoneIeWn9Aj3i25JqpeWbNoTIEWBEQ?q=machine+learning
Dishwasher - Food and Beverage,Mount Washington Alpine Resort,"Courtenay, BC",,"Regular temperature checks & maintenance of machines. Those applying to be a dishwasher will be highly motivated, work well on their own as well as in a team…",,SimplyHired,https://www.workopolis.com/job/eeXdrBnU_DF9Ch2PmkesIMO01MiUgSacQmjwRPoNXUhQho9ioo7vVQ?q=machine+learning
Big Data Engineer - Analytics,Interset,"Ottawa, ON",,"Familiarity with data science or machine learning packages (pandas, R, TensorFlow, etc…). Implement model data flows to support running cutting-edge machine…",,SimplyHired,https://www.workopolis.com/job/iRtaH4sSdBlnDk5_5L_KN5zsM5jsnqoW93K4ePrnlR0HeMAlEyhtRQ?q=machine+learning
Millwright,Flex-N-Gate Corporation,"Windsor, ON",,"Repairs and lubricates machines and equipment. “It engages you professionally, and provides learning opportunities.”. Work and dress safely (i.e.",,SimplyHired,https://www.workopolis.com/job/LWizTWRpwk1vLP4hxNeQs_KrQg0ltM4hYU6c1R6h4UjhlLas1XDw0g?q=machine+learning
IS Support Assistant,Bayshore HealthCare,"Ottawa, ON",,Strong commitment to continual learning. Support system/application account creation/deletion/reset/change/general maintenance - laptops/phones/Androids/desk…,,SimplyHired,https://www.workopolis.com/job/PjS1qKZKlPLgk9I1DSiXtEICbVI4eBCo7ggG6aCp848YbqSgC7m1-Q?q=machine+learning
Senior Software Engineer,PagerDuty,Remote,,"Experience with tools that ensure your high quality work makes a smooth, automated, repeatable transition from your machine to our staging and production…",,SimplyHired,https://www.workopolis.com/job/V8h2jT6-0wlMOe-MsJfPC1J8tF-hcvEm4qVRAKEneCJO4ihnV1_WAQ?q=machine+learning
Data Engineer,"AMZN CAN Fulfillment Svcs, ULC","Toronto, ON",,"Background in Big Data, non-relational databases, Machine Learning and Data Mining is a plus. You will apply Large-scale computing, Distributed systems, Data…",,SimplyHired,https://www.workopolis.com/job/tI_P1ypfC3nxt9oaC25nHGTReZjKkYr50QuXE5Bir145MBmf9__5qg?q=machine+learning
Counter Sales/Shipper Receiver,Brafasco,"Tiverton, ON",,"Internal Learning Centre for Career Development. Knowledge of machines and tools, (product knowledge) would be considered an asset.",Today,SimplyHired,https://www.workopolis.com/job/kUtoKUtDt2IieqLu2l-tXYzH8E2zUJMM1jiiP1-6KGnm9CIrJuO6wg?q=machine+learning
Assistant Moving Center Manager,U-Haul,"Edmonton, AB",,"The work involves moderate risks or discomforts which require special safety precautions, e.g. working around moving parts, machines, fumes, or irritant…",,SimplyHired,https://www.workopolis.com/job/zmiY2wzO7U-sNF80k1rCDw2TyHS-lPIcXnnueBbKWZEfta9Ab1_w7g?q=machine+learning
Utility 2/AZ Driver,Imerys,"Timmins, ON",,"Must be capable of learning operational equipment, specifically the operation of ForkLift and necessary Laboratory test equipment for in-process quality product…",,SimplyHired,https://www.workopolis.com/job/g1TtsnspuYvGie8nnD9SF5C_9Bg8izw0kcENkLUE17OowjZ7rt9muA?q=machine+learning
Spécialiste DataViz - TU,Keyrus Canada FR,"Montréal, QC",,"La Data Intelligence qui permet aux entreprises de tirer des axes de réflexion des données à leur disposition, et élaborer des décisions d’affaire (Intégration…",,SimplyHired,https://www.workopolis.com/job/Jin4tm03HuL9AG7JuLucRmeOYSnc54o2EOVYdELuXjbB7LUH0Noltg?q=machine+learning
Journeyperson Millwright,Pactiv,"London, ON",,"Performs electrical repairs on machines. On the job learning, certification programs, coaching and mentoring, training programs, leadership development and on…",,SimplyHired,https://www.workopolis.com/job/7vEHhRkyOlBrN-Cg1sOV4i-uWpdt3dZSwrj8DtWpfeomU7gtnGw2Tg?q=machine+learning
Product Manager,Geotab,"Waterloo, ON",,"Online learning and networking opportunities. Processing billions of data points a day, Geotab leverages data analytics and machine learning to improve…",Today,SimplyHired,https://www.workopolis.com/job/wJyHn-yexSJ-JvaK1zEOhldk6HxS6Wmq-KqUtqCJHlM50jsV9KphnQ?q=machine+learning
ECG Technician PT - ECG,Kingston Health Sciences Centre,"Kingston, ON",,"Identifies specific learning needs through annual self, peer, physician and managerial review of knowledge base, technique and performance.",,SimplyHired,https://www.workopolis.com/job/W8xgWWcucLuzyWycTOarfHZoeYodPe2d2uZ3KW46rTyzbbhHYJOOFA?q=machine+learning
Controls Engineer - Vision Systems Specialist,Tesla,"Richmond Hill, ON",,Provide direction and mentorship to third party machine/automation suppliers and/or Tesla Internal machine building team.,,SimplyHired,https://www.workopolis.com/job/9yE0Vw81mY84A3KHDd63O_1VOQvAIhO1nk0opFbcW_jl8jlVkI_5Tg?q=machine+learning
Product Manager: ML Platform,Workday,"Vancouver, BC",,"Guide machine learning engineering in the process of technical design, vendor evaluation, and use case prioritization with strong distributed system expertise.",10d,SimplyHired,https://www.workopolis.com/job/WocGAcVYv30VKFrVygg9bCfqXeZ4PGAqdkKum0BQfuHlDuz9UVwoyg?q=machine+learning
LensCrafters - Lab Manager (salary),Luxottica Group,"Calgary, AB",,"Maintains machines and diagnoses to support machinery functionality. With a career at LensCrafters, you’ll find yourself learning, growing, and interacting with…",,SimplyHired,https://www.workopolis.com/job/sgi5r_ur7fHdMxPK9H0-TXVSopzWUZL0ftvAhHcD1KMD2P5jx8Q_6g?q=machine+learning
Computer Vision Software Engineer,Bluewrist,"Markham, ON",,"Interest in learning and result oriented. Design, deploy and maintain standalone industrial machine vision and point-cloud processing applications.",,SimplyHired,https://www.workopolis.com/job/okcE2yCYR-X5bg-sE02J-11q5YyOUlXrh_38eWIh-HrdhykXy8v2_A?q=machine+learning
Senior AML Manager,Revolut,"Toronto, ON",,"You thrive in a collaborative space where everyone’s learning from each other, and learning fast. We want everyone at Revolut to own their story and their…",,SimplyHired,https://www.workopolis.com/job/-yz1H8tIcrGJPZsVDss9qPbO-cb5zK8VxF7rTvwLh9DyVoHEY07JJw?q=machine+learning
Electrician,Amcor,"Brampton, ON",,Know and understand all the safety aspects of machine operation. Responsible for the efficient and safe operating of all electrical equipment installed in the…,,SimplyHired,https://www.workopolis.com/job/q9Wi46JMj4ErMnWoMV2rYPMNsWi2xTTpNTm74eRGNfzQc8y3YmxvuQ?q=machine+learning
