job_title,company_name,job_location,job_salary,job_description,job_posted,posted_website,job_link
Scientific Associate II,University Health Network,"Toronto, ON",,Experience with machine learning and data modelling. This rich working environment provides ample opportunities for collaboration and scientific exchange with a…,13d,SimplyHired,https://www.workopolis.com/job/W3KwYZ4JSa6lX_JAcR03nc4MOEG2yMXFKXK4toiP_w7EUNO1q-rmMw?q=machine+learning
"Chercheuse/Chercheur scientifique, recherche appliquée - Séries chronologiques / Applied Research Scientist - Time Series Forecasting - Platform",Element AI,"Toronto, ON",,"Where useful, you will not hesitate to employ classical forecasting methods, but you are enthusiastic about the idea of pushing the boundaries of Machine…",,SimplyHired,https://www.workopolis.com/job/LAvbp2etYjvU6BwUvgRcYTrJmh9A-PdCeY7nbscbVHXC6SrkT1lJrQ?q=machine+learning
Assistant or Associate Professor in single-particle cryo-EM,Université de Montréal,"Montréal, QC",,"Intelligence, machine learning and deep learning networks at the Université de Montréal through interactions. Department of Biochemistry and Molecular Medicine,…",,SimplyHired,https://www.workopolis.com/job/tUIrSs9J5AFx2WS9wBZ5siA7zYLhE17mWN3-L4gtKYPwNmUyPk__nA?q=machine+learning
Data Scientist (Decision Science),Compass Digital Labs,"Mississauga, ON",,Experience with web scraping and machine learning model deployment. We're looking for a Data Scientist to join our decision science team investing in areas of…,,SimplyHired,https://www.workopolis.com/job/rEi_zuveDWaFlr9DwVp11_6_RQ-5-MZ44xYCdVAsTIK2x0sNnCQP7w?q=machine+learning
Postdoctoral fellow on clinical applications of vascular neuroimaging (100520),Sunnybrook Health Sciences Centre,"Toronto, ON",,Experience with multivariate methods and/or machine learning (e.g. The research will involve multivariate analysis and novel applications of deep learning with…,,SimplyHired,https://www.workopolis.com/job/MOYDKc5vyZ2gqxeVMOehpQVJzJfqFmldBDaXs9VFIQUdD0UcXf-tAQ?q=machine+learning
Desktop Analyst,Capgemini,"Brampton, ON",,The software platform leverages Machine Learning and Artificial Intelligence to make sure the right people end up in the right job.,,SimplyHired,https://www.workopolis.com/job/BG7WjDGg_T2HC3HvSJeXK_xjHo4oGBxze8ZZvaMfXKSB6pW5ImLbKA?q=machine+learning
Customs Administrative Assistant / CSR (Shift Work),Pacific Customs Brokers Ltd.,Canada,,"Be ready for some seriousongoing learning, though. We believe that when someone calls, it's because they want to talk to us and not to our machine (funny how…",,SimplyHired,https://www.workopolis.com/job/_xUWO2GZ4Y2VbBhRETnrXBjTIvnKbSxPgoh2obq67BWKwJKAj4Mc3Q?q=machine+learning
MEAN Stack Developer,DOSarrest,"Vancouver, BC",,"DOSarrest has immediate openings for 2 Full Stack developers to join our in-house development team. Our development team is responsible for the creation,…",,SimplyHired,https://www.workopolis.com/job/050O5nsrtKt_tRXuuOIh_JFlZOXyFDFEZe-AdJ6S6qbPMtGhg5eNIA?q=machine+learning
Postdoc Researcher - Particle Physics / Rare Decay,TRIUMF,"Vancouver, BC",,Interest in machine learning techniques. And nuclear physics and accelerator-based science. We are an international centre for discovery and.,,SimplyHired,https://www.workopolis.com/job/8vPVJq_CWq4hiZIeYH2ENYMFEoJPmT78Y0FZHJXPvyc0FFl2ocbcrA?q=machine+learning
Planner,Lululemon,"Vancouver, BC",,"Conduct hindsight analysis to incorporate learnings into current and future plans. Reporting directly to the manager of merchandise planning, this position is…",13d,SimplyHired,https://www.workopolis.com/job/r6iN8VhEX_ZxyqESw7bF62IMsJdvqn8LLV2hHBJFOS1UE5hA-e7dIA?q=machine+learning
Construction Labourer,Mattamy Homes,"Greater Toronto Area, ON",,"Experience dealing with tools and machinery, includes machine skills – rough grading, digging hydro, gas trenching, water boxes, backhoe operation, etc.",,SimplyHired,https://www.workopolis.com/job/UuGhC8XwSgv0vHiiTGa1Y_SXq2KmzIzEZj7JdmUhaxrEFOgyxva9Vw?q=machine+learning
Machine Operator,Silfab Solar,"Mississauga, ON",,MACHINE OPERATOR – ELECTRONIC EQUIPMENT MANUFACTURING.  Operate automatic and semi-automatic machines to position.  High School diploma or equivalent.,,SimplyHired,https://www.workopolis.com/job/P7H70pMQTxdyDMOm2A8W3I4OqrfMF7OVpiaifsV-KFLAG-yq21cBnw?q=machine+learning
"Research Scientist, AI",Facebook,"Montréal, QC",,"Individuals in this role are expected to be recognized experts in identified research areas such as artificial intelligence, machine learning, computational…",,SimplyHired,https://www.workopolis.com/job/0cE6NbZ2ooHtG062gErUfMg54j1KvyHEnKzWwHya9MPW9TZXhlC3Rg?q=machine+learning
"Postdoctoral Position in the Vision and Learning Lab, University of Alberta",University of Alberta,"Edmonton, AB",,"We are setting up a new lab at the ECE Department, University of Alberta, focusing on exciting research topics in computer vision and machine learning, such as…",,SimplyHired,https://www.workopolis.com/job/6mBwqtDvRAAlwf3n4E1sLo47ckoeb1_b73fwK9L3Nt2uc0WP9iiCnA?q=machine+learning
Data Scientist - Lodging Team,Hopper,"Toronto, ON",,"Experience with data mining, machine learning, statistical modeling tools and underlying algorithms. Use machine learning and big data tools on large and…",,SimplyHired,https://www.workopolis.com/job/nVO-SxRJoeKkpyGNSGRmv1tqBs7F4UG2OiIp5QWgqVw9RLirqkxgtw?q=machine+learning
Quantitative Research Analyst,"Connor, Clark & Lunn Financial Group","Vancouver, BC",,"Two to five years of work experience where the primary responsibility involved the application of mathematics, statistics, machine learning or other empirical…",,SimplyHired,https://www.workopolis.com/job/U54te6CG6-KKeK1qbLOELIsBuo8YLxxgLdxTksXl8LJkye-rziAn9g?q=machine+learning
AI Engineer,Cerebri AI,"Toronto, ON",,"Any other related experience with Big Data, artificial intelligence, natural language processing, machine learning and/or deep learning, predictive analytics.",,SimplyHired,https://www.workopolis.com/job/vfcXbJH-T734MZdUrqEDf_6O4IIpqVWazBSb--wM_Bn5Oh_WIc8q9w?q=machine+learning
"Senior Outbound Product Manager, Machine Learning",Workday,"Vancouver, BC",,"Senior Outbound Product Manager, Machine Learning. Come and join the new Machine Learning Strategic Product Initiatives team where your charter will be Machine…",13d,SimplyHired,https://www.workopolis.com/job/FavRSpL8cTc6nd-nOKMuhT94QOwkknaBKy7DtvUrOG4hizHnvnZreg?q=machine+learning
Data & Automation Analyst,AbCellera Biologics,"Vancouver, BC",,"At AbCellera, we’re solving tough problems and creating innovative solutions from the ground up - custom immunizations, microfluidics, high-throughput imaging,…",,SimplyHired,https://www.workopolis.com/job/9-rTpIz3WAN48uC-HkSJKTeATFJvQ1HwQWQmvcGQaeFk3_zDpPfksw?q=machine+learning
Embedded Software Developer,Zaber Technologies,"Vancouver, BC",,"You like problem solving, challenges, and the process of learning - you dive in when you see behaviour you don't think makes sense.",,SimplyHired,https://www.workopolis.com/job/5yuy40hhd4HYQ2X6okExoiOcOC4FwvtOkS3OrRfXYxJsAoi4jv2zzQ?q=machine+learning
Physical Design Intern - Spring 2021,NVIDIA,Canada,,"More recently, GPU deep learning ignited modern AI — the next era of computing. We are now looking for a Physical Design Intern! What you will be doing:",,SimplyHired,https://www.workopolis.com/job/k_6-eFBP2YQWSgcncOAUckUl-n9kJM4-_AAodOXNFTcu7DYP22EPCQ?q=machine+learning
Data Engineer,Micro Focus,"Ottawa, ON",,"DevOps | IT Operations | Cloud | Security | Info Governance | Big Data, Machine Learning, & Analytics. At Micro Focus, everything we do is based on a simple…",,SimplyHired,https://www.workopolis.com/job/Cj3KMupafmz_tVC4L76nerFjN-D9uupNO34xDd23bloaN4hiSJ5LiA?q=machine+learning
Anaesthesia Assistant (IPP),Michael Garron Hospital,"East York, ON",,Demonstrated commitment to continuous learning. Management and troubleshooting of various types of anaesthesia gas machines.,,SimplyHired,https://www.workopolis.com/job/BrsoDl-ZMvlQ-s2movJLq-Qs4x0I0sjS3wZZGA--s2ar11a8bU0-Kg?q=machine+learning
Data Architect,IQ Hunt,"Toronto, ON",,"Cloud, Database, Big Data, BI, Data Science, Machine Learning, Artificial Intelligence. Our Client requires the services of a Data Architect to initiate an…",,SimplyHired,https://www.workopolis.com/job/07hD0xeJqkNHTUq4S5k9W6GoU-r9PrEGHEC845LEz_vM_kqSi9u2sA?q=machine+learning
MBVS: Assistant,Winpak,"Winnipeg, MB",,"Work with the operators to develop operational skills, with a focus on standard work and supervised learning. Able to update MES schedules as required.",,SimplyHired,https://www.workopolis.com/job/qS-jIj5_tB2am0BoyyHYQ1kImeyzIF12mT17qCNR17RzvqyGiZgDEw?q=machine+learning
Stagiaire en recherche – FATE Research Intern- FATE,Microsoft,"Montréal, QC",,"Currently enrolled in a PhD program in computer science (e.g., machine learning, human-computer interaction, computational social science, information retrieval…",8d,SimplyHired,https://www.workopolis.com/job/potGKziv5vpqP9vbdGuGS8a380dfXT3vkmzfY-HuVE_NwxTmckmQKA?q=machine+learning
Software Development QA,Fortinet,"Burnaby, BC",,"Strong systems experience on Linux, bare-metal and virtual machines. This is a great opportunity to gain experience in the computer network security industry…",,SimplyHired,https://www.workopolis.com/job/BztwzPv-eYoR0ur3tfAh6NrUC-_ke9Pd-6_aT0gOL2dzjEZBmKZ7MQ?q=machine+learning
R&D Engineer,BenchSci,"Toronto, ON",,"A solid understanding of machine learning lifecycle in production systems. Guide the development of a prototype into a mature, production-grade system within…",,SimplyHired,https://www.workopolis.com/job/Ggz0q6DJA8uwPoXGDKQB5jSToJbNI1shrza-TPr1G5A1Unx8hmLv0A?q=machine+learning
Applied Scientist,"AMZN CAN Fulfillment Svcs, ULC","Toronto, ON",,"2+ years of experience of building machine learning models for business application. PhD or equivalent Master's Degree plus 4+ years of experience in CS, CE, ML…",,SimplyHired,https://www.workopolis.com/job/jbbtQNqFKeBvwxN_cO0bLBHuzNT1pLv0VCJpO9Td3fPps4S52815rw?q=machine+learning
Full Stack Developer (Remote),trajectorE management,"St. John's, NL",,"With the help of machine learning and artificial intelligence, totaliQ provides organizations with useful insights to plan future projects, which improve…",,SimplyHired,https://www.workopolis.com/job/NFaCReZ4UJ3OJzpwPsdoVZSyyiVwAkVxgf17ARedPgtE-7h1uJ2W2A?q=machine+learning
Software Developer - Desktop Applications,AbCellera Biologics,"Vancouver, BC",,"Develop visualizations for the results of our machine learning analysis pipelines. You will be joining a multi-disciplinary team of engineers, with expertise in…",,SimplyHired,https://www.workopolis.com/job/yaddAsCBr9wUsbwO5MAKBLcXNuXPb8jH-aB59srCGYmDoY6L9tcBNg?q=machine+learning
"Data Scientist, People Analytics",Restaurant Brands International,"Toronto, ON",,Play a key role in developing our advanced analytics and machine learning capabilities within the People space. Some applications of this methodology:,,SimplyHired,https://www.workopolis.com/job/aywliozyNvSMpxn2pFxCDJxyT6y3uL11EJiilj_r8jPnxG4EslGZ2w?q=machine+learning
Biostatistician II,University Health Network,"Toronto, ON",,"Transforming lives and communities through excellence in care, discovery and learning. University Health Network (UHN) is looking for an experienced…",,SimplyHired,https://www.workopolis.com/job/Pao049CD7gZLoF5gOy-S-3agJ2B8wgLfuSWiiXc2G5X490zh-9R0uw?q=machine+learning
Forensics Data Intern,Entrust Datacard,"Ottawa, ON",,"Forensics Data Intern -Career Growth, Flexibility and Collaboration! Ottawa, Ontario or Shakopee, MN. Entrust is dedicated to securing a world in motion by…",,SimplyHired,https://www.workopolis.com/job/9PTEPWpnccPs9H2IGdmGXxQrT7vSQq0QrunrJzyl97MhDzoyPaxwHw?q=machine+learning
Farm Laborer,"Parrish & Heimbecker, Limited","Ayton, ON",,"Operating farm machinery , i.e. ventrac, tractor and the egg packing machine. Honesty and integrity with a focus on listening and continuous learning.",3d,SimplyHired,https://www.workopolis.com/job/QtAkycasmaJb0Twl3yROwcNeOscbTxWLKI5vtgzf31NWaZwOp1Bfig?q=machine+learning
Video Researcher,Tveon,"Kelowna, BC",,Tveon is looking for dedicated researchers to join our Kelowna or Calgary team. The successful candidates will work with us to discover and prototype new…,,SimplyHired,https://www.workopolis.com/job/uIVhnjkxjxALHiVdl-v66vqQorG5VOu2lN5MvDmL3cNLxyVdH5gG-Q?q=machine+learning
Software developer,Capgemini,"Brampton, ON",,The software platform leverages Machine Learning and Artificial Intelligence to make sure the right people end up in the right job.,,SimplyHired,https://www.workopolis.com/job/V77oEz6f6oRc_y5eHwW9O1nqK1hCoRFG2T8818oNVnL0K-riwHV_ZA?q=machine+learning
Data Analyst,Hopper,"Toronto, ON",,"Hopper was built on the premise that the combination of big data and machine learning could make a difference. At Hopper, every dataset tells a story.",,SimplyHired,https://www.workopolis.com/job/M-ZxCH5-ywKGxtGzp7_Bj9IthKqHOg41sxXh39tGRVVI_4N5ayhZ0g?q=machine+learning
Data Scientist,Amazon Dev Centre Canada ULC,Ontario,,"Experience applying machine learning to real-world production systems, analytic development based on SparkML and other ML libraries such as scikit-learn, caret,…",,SimplyHired,https://www.workopolis.com/job/SajmszC6AduuvzPv3-41VF7j6DtCg1LveYGDGKyJvV7z6wBUrOGjxQ?q=machine+learning
Fraud Strategy & Analytics,Neo Financial,"Calgary, AB",,"Use advanced machine learning techniques to design and develop fraud detection models. At Neo, we empower people to get the most out of their money and time.",12d,SimplyHired,https://www.workopolis.com/job/Z3_1-0ynR2Gk9ZX7tQipmCrpGh-QOnoMksHq0nUyoeyv_c6XLFFvcg?q=machine+learning
"Fish Processing Plant Worker - Blacks Harbour, NB",Cooke Aquaculture Inc.,"Blacks Harbour, NB",,"Set up and operate machines to box or package fish products. The ability to bring your passion for learning, desire for growth and energy for moving your career…",,SimplyHired,https://www.workopolis.com/job/r4D2yc9aPyLgHz71dqswtK0nEZKuCdvRvFmd7JyB0JmmmYetXbt4Og?q=machine+learning
"Senior developer Backend AWS IoT, Machine Learning & AI",Services Conseils IntelliSoft inc.,"Montréal, QC",,"Knowledge of Machine Learning and AI. Senior developer Backend AWS IoT, Machine Learning & AI. WiFi Motion Analytics is growing and we’re looking to add a Lead…",,SimplyHired,https://www.workopolis.com/job/j8KzSVMADlmSx1QZyrwEN-qJftXRwyn7-GEuDKcRYGwdqunHWi-OpA?q=machine+learning
IT Technology Associate Consultant/Developer,SAP,"Vancouver, BC",,"Interest / Knowledge in latest technology trends in MarTech as well as Machine Learning, Artificial Intelligence, Robotic Process Automation, etc. are…",10d,SimplyHired,https://www.workopolis.com/job/Zw4rt7yOtEoCOhFCSGurmuMIaqn6XSB1fdC3Az9FcNhIBihz5xE-ig?q=machine+learning
"Specialist System Design, Data Scientist Machine Learning and Visual Analytics",Canadian National Railway,"Montréal, QC",,"2+ years of experience in data modelling and Python libraries for data science, application development or application support in machine learning, visual…",,SimplyHired,https://www.workopolis.com/job/hx8olxKJfolhfbKTqsugIrSACHQA04sgvkkyzoS1bhNykj8CTNsEvg?q=machine+learning
Instructor I,Carleton University,"Ottawa, ON",,"The School has 40 full-time faculty members and particular research strengths in computational geometry, computer security, big data analytics, databases and…",,SimplyHired,https://www.workopolis.com/job/BwkAs1sMgJ5BigU8GeDqmWMQQxbMCQOdWnrhy6b2DH2UBnmsvPsuBQ?q=machine+learning
Business Intelligence Data Analyst / Engineer,Aurora Cannabis,"Vancouver, BC",,Automate reporting solutions and operationalize machine learning models. Hand on experience with deployment and monitoring of machine learning models.,,SimplyHired,https://www.workopolis.com/job/xXsLpbcl_rn2MMI97vRoSeItXQuMRczMdbzoLwKgBDWdvc19vfjk1w?q=machine+learning
Data Application Developer,Rogers Communications,"Brampton, ON",,"Develop and support scalable and highly available data applications enabling analytical, machine learning and other business functions. What you will be doing:",,SimplyHired,https://www.workopolis.com/job/G1OwoFF_KTFpxJPBW26dFRWgvVMYoqB3rGbZE6HMOdSFjMklfwVvpg?q=machine+learning
Conformal Coating Operator,Dorigo Systems,"Burnaby, BC",,"Operate conformal coating machine such as spray machines, curing ovens, and inspect results to the acceptance criteria. High School diploma or equivalent.",,SimplyHired,https://www.workopolis.com/job/GU8U2lK9zrL3sby71AL52ZDTh0Aph_iue8ofgrApJfzUekOxSeyihA?q=machine+learning
"Scientist, Computational Biology",University Health Network,"Toronto, ON",,"Transforming lives and communities through excellence in care, discovery and learning. As part of the Vector Institute, the candidate will have the freedom to…",,SimplyHired,https://www.workopolis.com/job/_oJkI_4P8cbkEe2T29YJkqrujcrLfpYm6YSFivJo1b8T99bAzm6Eug?q=machine+learning
"Analytics, Data Scientist, Associate",PwC,"Toronto, ON",,Analytics solutions are developed aligned to client maturity and range from descriptive to prescriptive models leveraging various methods or approaches …,6d,SimplyHired,https://www.workopolis.com/job/8C_p4JojOWURjCWS5CvEZYbbeOHjeQajdDA6NCQmCSkzm1nvJiifbg?q=machine+learning
Casual Caretakers 2020-2021,Parkland School Division No. 70,"Stony Plain, AB",,"Stripping and scrubbing floors using swing buffing machine. We assure supportive learning environments, meaningful experiences and healthy relationships that…",,SimplyHired,https://www.workopolis.com/job/3VSbBDUYs1zqcKIILJQfoNscQERAqn7sKZM1ykoE7y8MUI3FJh1gIA?q=machine+learning
QA Developer,Algolux,"Montréal, QC",,You will be a key part of a team that develops machine learning solutions for digital cameras in self-driving cars.,,SimplyHired,https://www.workopolis.com/job/pDqAV32DNbYzYTOdvLM-FJGVu8XAYAofOspZOvIEb1F9Kt-hMhCP_w?q=machine+learning
Principal Data Scientist,Vanguard,"Toronto, ON",,"Experience utilizing statistical and machine learning methods required. Leads the execution of large scale, more complex analytics projects.",,SimplyHired,https://www.workopolis.com/job/biCbPTHLCRIyK720bWjXUR1eEo_KOpcLva2m7RwfKcjPTuM8Uux_8w?q=machine+learning
"Research Scientist, Core ML",Facebook,"Montréal, QC",,"Individuals in this role are expected to be recognized experts in identified research areas such as artificial intelligence, machine learning, computational…",,SimplyHired,https://www.workopolis.com/job/LqTgWeyO7HdQf6ti-s9cLbbVxfBmgYcjRLNioxn4A5jqGsdz_6mA_w?q=machine+learning
Medicine - Tenure-track position - Bioinformatics / Artificial intelligence,University of Ottawa,"Ottawa, ON",,The new faculty member will have a background that will allow them to successfully develop a dynamic and collaborative research program that includes a focus on…,9d,SimplyHired,https://www.workopolis.com/job/yYLjLG4L-FeLNjeeoRHCpNCg1oFeUN8w9obkQmenFBAR09VWZne5bw?q=machine+learning
Tenure-track Faculty Positions in Quantum Matter,Perimeter Institute for Theoretical Physics,"Waterloo, ON",,The successful applicant will play a leading role in the growth of Perimeter's efforts in quantum matter and in integrating these activities with other related…,,SimplyHired,https://www.workopolis.com/job/MY1WyzNkqFp_LoYEAYvoXbPfUr8UVWdxkf3i57Cme4hAgz4NJAkdnQ?q=machine+learning
ML Platform Engineer (Remote),Yelp,Remote,,Gain expertise in cutting-edge machine learning infrastructure. Want to build cutting-edge tooling for machine learning? What We Are Looking For:,,SimplyHired,https://www.workopolis.com/job/pB7jUmB0MtqrFvLZIa5datmWWN89tmxm4a1K0d__TFa5q4P5vSGGhw?q=machine+learning
Compensation Analyst,Geotab,"Oakville, ON",,"Online learning and networking opportunities. Processing billions of data points a day, Geotab leverages data analytics and machine learning to improve…",,SimplyHired,https://www.workopolis.com/job/Cmx69TzDE1SGMtjGnuUr0-1o3OceezYaTBO-dsec4DCtxmESN2-lzQ?q=machine+learning
Data Engineer,Keyrus,Canada,,Data Intelligence to enable companies to draw critical insights from their data and shape business decisions (Data Integration | Cloud Migration | Business…,,SimplyHired,https://www.workopolis.com/job/jVzot86f-o-bRBuydl526qkCaQurYUm-olJkLil9uty-2GkS7iZMsw?q=machine+learning
Unity Developer,VR Vision,"Toronto, ON",,"Outside of a foundation in computer science or software engineering, what we’re looking for most is someone who loves exploring, learning and creating.",,SimplyHired,https://www.workopolis.com/job/chub5nb9cl_a5j0EKdqG5kcyKo-1bZywLhY5Pf7bGs42WA0-yGTmPA?q=machine+learning
Data Analytics Manager,Pure Sunfarms Corporation,"Delta, BC",,"Machine learning and AI methodologies and concepts. Driven by a love of plants, Pure Sunfarms is one of Canada’s largest, single-site, licensed.",,SimplyHired,https://www.workopolis.com/job/4ZXSuzgItfTtB84LtlQy7Q18Y2bNeGZf7-qCR9mDoI_jBEeLumshGA?q=machine+learning
AI Architect,SOTI Inc.,"Mississauga, ON",,"5 + years of experience in building machine learning models. Working knowledge of Machine Learning, techniques, algorithms, natural language processing.",,SimplyHired,https://www.workopolis.com/job/2hy4ecPUijOaSXkPVloE7vNoLiQR4xW-J3Q4h1Prz1F2qn8b4UXKEw?q=machine+learning
Data Scientist,Providence Health Care,"Vancouver, BC",,"Demonstrated proficiency using machine learning methods and techniques (including neural networks, reinforcement learning, and adversarial learning) and machine…",,SimplyHired,https://www.workopolis.com/job/4cl-nx3SAXo5v2KbWEoR9J4YOzF5UQiz8QPQUwDAtbWihwVo2d2Knw?q=machine+learning
Information Designer,AbCellera Biologics,"Vancouver, BC",,"To succeed, we have created innovative solutions at every step - custom antigen preparation and immunizations, microfluidics, high-throughput imaging, genomics,…",13d,SimplyHired,https://www.workopolis.com/job/a8xXUgUbcJGcI_UfICuoeSDe98p9zV2v-tawis3m-DaxZK2-b881_A?q=machine+learning
Front-End Web Developer,StackAdapt,"Toronto, ON",,This state-of-the-art platform is where some of the most progressive work in machine learning meets cutting-edge user experience.,2d,SimplyHired,https://www.workopolis.com/job/_044zv8pHNz2L76x36ci0qKuSJYpe9A3DU7x4XWQRlpYQlMWr67H8A?q=machine+learning
Program Manager,SickKids,"Toronto, ON",,"We apply a wide range of analysis techniques, including machine learning to gain a better understanding of critically ill patient behavior.",10d,SimplyHired,https://www.workopolis.com/job/O51aFpSGFIgyquEHBfd3xmpmPHMyJWM26aXOXmCGPU7VRXV5_rKnzA?q=machine+learning
Data Support Engineer,Capgemini,"Toronto, ON",,The software platform leverages Machine Learning and Artificial Intelligence to make sure the right people end up in the right job.,,SimplyHired,https://www.workopolis.com/job/yg5RIgrN_sinzKQcPHPmiLMGf-nLknV4-5XVmWUrVAY_C2lRZGyGqQ?q=machine+learning
Data Analyst II,Zynga,"Toronto, ON",,"Statistics, experimental design, machine learning, deep learning. Work closely with game team to design, test, verify and implement machine learning models and…",,SimplyHired,https://www.workopolis.com/job/-3_5qg96glJD2fhrJ3k5dlgZWwUirnpsafeMvQCoJoG_X5j7Jk8gbA?q=machine+learning
Programmer,Magna International Inc.,"Brampton, ON",,"Prepare machine logbooks and required reports (ShiftWorx logs) on daily basis. Perform job set-up, tool-setup and quality checks on milling machines as per LMS…",,SimplyHired,https://www.workopolis.com/job/UnowqhF-oclEIh5eQ5oTVnjzA_j4JKvNARHsMBL8YX0nQmLOKHsKsQ?q=machine+learning
Enterprise Full Stack Developer,TMX Group Limited,"Toronto, ON",,"Experience designing a technology stack for machine learning is a plus. We are looking for passionate, hard-working, and talented senior full-stack engineers to…",,SimplyHired,https://www.workopolis.com/job/FHlKzGBBTqcVOiHTAQ1AC7J3AKsInmkZ95Tywpt4ulbO8qxwL2JPTA?q=machine+learning
Senior Data Scientist,BMO Financial Group,"Toronto, ON",,"R, Python, SQL) and machine learning /deep learning algorithms/packages (e.g. Develops agreed analytical solution by applying suitable statistical & machine…",,SimplyHired,https://www.workopolis.com/job/djEzzPCe6puIpMeKkeRn7H1_cQHbPx_G0FsCEXPPKS9KpJ-DXCrDzw?q=machine+learning
Sr. Full-Stack Software Engineer - Machine Learning,Splunk,"Vancouver, BC",,"Knowledge of machine learning concepts. An abundance of opportunities to have an impact, work with and learn about cutting edge tools and technologies in…",,SimplyHired,https://www.workopolis.com/job/QqxodjLfZzPrGr3jhs57AHyEQzpnrIEHe21vW_DrB9Y_-od_G0Ctnw?q=machine+learning
Data Scientist Intern,Guavus,"Montréal, QC",,Algorithmic understanding of standard machine learning methods. Implement ETL & machine learning algorithms and benchmark their performances.,,SimplyHired,https://www.workopolis.com/job/5zdiNzVKuaa4it6VHo1iQBvpHDVjQXbKVaIFlgHCNLmoRejvTRjqsA?q=machine+learning
"Post-Doctoral Research Fellow, Inclusive Design Research Centre",OCAD University,"Toronto, ON",,"At the same time, the project will tackle bias and exclusion of persons with disabilities in data systems and ensure that these systems (including artificial…",,SimplyHired,https://www.workopolis.com/job/wq9IB4fOj93Rd6aGQ-fXdOS71FPBIfwaHgpMnWaZ-4vg2IElgOskVg?q=machine+learning
Sessional Instructional Assistant: RSM2008H - Creative Destruction Lab Intro Course,University of Toronto,"Toronto, ON",,"This course will also introduce you to the business of artificial intelligence (AI) and you will explore what machine learning is, what its economic properties…",Today,SimplyHired,https://www.workopolis.com/job/zJXqo6kq7Xxw7gD7RLvhe8Zo5yg6smFC2UxZDJxZAOhEHlKUXIddtQ?q=machine+learning
Data Scientist II,Zynga,"Toronto, ON",,"Statistics, experimental design, machine learning, deep learning. Work closely with game team to design, test, verify and implement machine learning models and…",,SimplyHired,https://www.workopolis.com/job/CEondpoL_lswbQnwT4rV3uRcYeWdrnpjx54LD0ePaGYeq-FMbv5TVA?q=machine+learning
